{
  "schemaVersion": 1,
  "baseline": "V80",
  "description": "V80 baseline; 16 opportunity records including specific tracks and school registration stages, 15 official notices reviewed. fm-008 deadline conflict remains pending. Records are not counts of distinct national competitions.",
  "opportunities": [
    {
      "name": "中国国际大学生创新大赛（2026）",
      "cat": "竞赛",
      "direction": "创业实践",
      "org": "教育部等部门、江苏省人民政府",
      "aud": "以官方赛道规则及学校审核为准",
      "field": "全国",
      "a": 0.0,
      "note": "总决赛2026年11月；校赛、省赛时间独立；不应作为当前可报名机会",
      "id": "fm-001",
      "dates": {
        "start": "2026-08-10",
        "end": "2026-09-25",
        "award": null,
        "deadlineAt": "2026-09-25T12:00:00+08:00",
        "timezone": "Asia/Shanghai",
        "published": "2026-07-31"
      },
      "source": {
        "url": "https://www.moe.gov.cn/srcsite/A08/s5672/202607/t20260731_1445670.html",
        "kind": "official-notice",
        "verification": "verified",
        "verifiedAt": "2026-10-25",
        "lastAttemptAt": "2026-10-25",
        "lastAttemptResult": "http-200-body-reviewed",
        "importedClaimedCheckedAt": "2026-10-24",
        "importedClaimedStatus": "已截止",
        "registrationOpenOn": null,
        "evidence": {
          "bodySha256": "afb111d5dd7293faccce913108d624e731f34287cbf8eced91b832cda91cce9c",
          "quotes": [
            "报名系统开放时间为2026年8月10日，报名截止时间为9月25日12时。",
            "参赛人员年龄不超过35岁"
          ],
          "scope": "核实公告所载日期与已列资格；不代表审核通过或实时接受报名。",
          "monitorHash": "0ad4adbf6277cbd54327455868354fe0f84520908f25db370d6b6ac3928b3a26"
        }
      },
      "eligibility": {
        "schools": [],
        "regions": [],
        "degrees": [],
        "enrollmentYears": [],
        "studyYears": [],
        "majorGroups": [],
        "enrolled": null,
        "rulesComplete": false,
        "basis": "2026-10-25 已阅读官方正文；仅将明确条件用于硬匹配，其余条件在资格路径中复核。",
        "studyModes": [],
        "leaderStudyYears": [],
        "teamSize": null,
        "requirements": []
      }
    },
    {
      "name": "第十四届全国大学生数字媒体科技作品及创意竞赛",
      "cat": "竞赛",
      "direction": "科技创新",
      "org": "赛事官网",
      "aud": "详见赛区及官网规则",
      "field": "全国",
      "a": 2.4,
      "note": "报名与作品提交已截止。12月4—6日颁奖典礼/作品展览为待定安排，不作为确定评奖日期。",
      "id": "fm-002",
      "dates": {
        "start": null,
        "end": "2026-10-23",
        "award": null,
        "deadlineAt": "2026-10-23T23:59:59+08:00",
        "timezone": "Asia/Shanghai",
        "published": null
      },
      "source": {
        "url": "https://www.cmit.cn/wap/index.html",
        "kind": "organizer-site",
        "verification": "verified",
        "verifiedAt": "2026-10-25",
        "lastAttemptAt": "2026-10-25",
        "lastAttemptResult": "http-200-body-reviewed",
        "importedClaimedCheckedAt": "2026-10-24",
        "importedClaimedStatus": "已截止",
        "registrationOpenOn": null,
        "evidence": {
          "bodySha256": "ed298997b38a1bc38fb15b45cb2e014774918636d9c3cc186c455ae9e2b18313",
          "quotes": [
            "⏰ 2026年10月23日23:59:59截止",
            "每个参赛团队学生人数不超过5人"
          ],
          "scope": "核实公告所载日期与已列资格；不代表审核通过或实时接受报名。",
          "monitorHash": "0c5ec46fa26cb47a4dad8363a9f1a7baca5fa99bc6ad26903003772cb0dffbd9"
        }
      },
      "eligibility": {
        "schools": [],
        "regions": [],
        "degrees": [],
        "enrollmentYears": [],
        "studyYears": [],
        "majorGroups": [],
        "enrolled": null,
        "rulesComplete": false,
        "basis": "2026-10-25 已阅读官方正文；仅将明确条件用于硬匹配，其余条件在资格路径中复核。",
        "studyModes": [],
        "leaderStudyYears": [],
        "teamSize": null,
        "requirements": []
      }
    },
    {
      "name": "重庆交通大学2027年大学生创新创业训练计划培育项目",
      "cat": "科研",
      "direction": "科技创新",
      "org": "重庆交通大学教务处",
      "aud": "该校全日制普通本科生，负责人限二、三年级等",
      "field": "重庆交通大学校内",
      "a": 4.8,
      "note": "学生材料11月20日前提交；学院11月23日前推荐。二、三年级仅限制负责人；成员不受此年级硬限制。导师、在研项目与参与数另须核实。 须团队申报、至多5人；公告未列最小人数，需另核。",
      "id": "fm-003",
      "dates": {
        "start": null,
        "end": "2026-11-20",
        "award": null,
        "deadlineAt": null,
        "timezone": "Asia/Shanghai",
        "published": "2026-10-16"
      },
      "source": {
        "url": "https://jw.cqjtu.edu.cn/info/1074/11035.htm",
        "kind": "official-notice",
        "verification": "verified",
        "verifiedAt": "2026-10-25",
        "lastAttemptAt": "2026-10-25",
        "lastAttemptResult": "http-200-body-reviewed",
        "importedClaimedCheckedAt": "2026-10-24",
        "importedClaimedStatus": "日期待核实",
        "registrationOpenOn": null,
        "evidence": {
          "bodySha256": "c9ff8b7ed8161ed5f51fca30e81d9bbb43b4026ccce47bba2ebb60d1748b6af9",
          "quotes": [
            "项目负责人于11月20日前通过项目管理平台",
            "项目负责人须为全日制普通本科二年级或三年级学生",
            "团队人数不得超过5人"
          ],
          "scope": "核实公告所载日期与已列资格；不代表审核通过或实时接受报名。",
          "monitorHash": "11663a4f00e96e9c29640d5c621d20e8d99508b290de94b583a7dbd8c5b155c3"
        }
      },
      "eligibility": {
        "schools": [
          "重庆交通大学"
        ],
        "regions": [],
        "degrees": [
          "本科"
        ],
        "enrollmentYears": [],
        "studyYears": [],
        "majorGroups": [],
        "enrolled": true,
        "rulesComplete": false,
        "basis": "2026-10-25 已阅读官方正文；仅将明确条件用于硬匹配，其余条件在资格路径中复核。",
        "studyModes": [
          "全日制"
        ],
        "leaderStudyYears": [
          2,
          3
        ],
        "teamSize": {
          "min": null,
          "max": 5
        },
        "requirements": [
          {
            "id": "team-formed",
            "label": "已组成申报团队，且各成员分工明确",
            "quote": "申请者必须是团队"
          },
          {
            "id": "project-count",
            "label": "计入本次申报后，我参与的项目不超过2项",
            "quote": "每名学生最多参与2个项目"
          },
          {
            "id": "leader-clear",
            "label": "本人作为负责人只申报1项，且没有尚未结题的负责人在研项目",
            "quote": "项目负责人在研项目未结题时不能作为负责人申报新的项目",
            "whenRole": "负责人"
          },
          {
            "id": "mentor",
            "label": "已确认指导教师及其指导名额；创业实践项目已满足双导师要求",
            "quote": "创业实践项目实施学校导师和企业导师的双导师制"
          },
          {
            "id": "original-project",
            "label": "项目未重复立项，也不是已参赛作品或毕业设计题目",
            "quote": "已参加过各级各类竞赛的作品、已作为毕业设计（论文）进行的题目，不得申报"
          }
        ]
      }
    },
    {
      "name": "中国石油大学（华东）2027批次大创（创新训练·负责人申报）",
      "cat": "科研",
      "direction": "科技创新",
      "org": "中国石油大学（华东）教务处",
      "aud": "本校学生；原则上主要面向全日制本科二、三年级，例外需院部确认",
      "field": "中国石油大学（华东）校内",
      "a": 7.2,
      "note": "本条节点是创新训练项目负责人填申报书：11月1—8日。学生选题及师生互选为10月23—31日；创业训练/实践的时间另行通知。原则性年级条件不作为绝对排除。",
      "id": "fm-004",
      "dates": {
        "start": "2026-11-01",
        "end": "2026-11-08",
        "award": null,
        "deadlineAt": null,
        "timezone": "Asia/Shanghai",
        "published": "2026-10-08"
      },
      "source": {
        "url": "https://jwc.upc.edu.cn/2026/1008/c18523a502163/page.htm",
        "kind": "official-notice",
        "verification": "verified",
        "verifiedAt": "2026-10-25",
        "lastAttemptAt": "2026-10-25",
        "lastAttemptResult": "http-200-body-reviewed",
        "importedClaimedCheckedAt": "2026-10-24",
        "importedClaimedStatus": "日期待核实",
        "registrationOpenOn": null,
        "evidence": {
          "bodySha256": "af6384c5b4baca098d69577c921efe93e1bf669e83106ac5220e69137105a70b",
          "quotes": [
            "11 月 1 日-11 月 8 日",
            "项目负责人填写申报书",
            "10 月 23 日-10 月 31 日"
          ],
          "scope": "核实公告所载日期与已列资格；不代表审核通过或实时接受报名。",
          "documentUrl": "https://jwc.upc.edu.cn/_upload/article/files/5b/e4/e6c864274535810713862774c4df/de72f1f1-7873-4881-80d9-1244c7abf652.pdf",
          "monitorHash": "964c95d737da0b7c6c051c79791a8e10f364090c6015c6ce602efe9acab957dc"
        }
      },
      "eligibility": {
        "schools": [
          "中国石油大学（华东）"
        ],
        "regions": [],
        "degrees": [],
        "enrollmentYears": [],
        "studyYears": [],
        "majorGroups": [],
        "enrolled": null,
        "rulesComplete": false,
        "basis": "2026-10-25 已阅读官方正文；仅将明确条件用于硬匹配，其余条件在资格路径中复核。",
        "studyModes": [],
        "leaderStudyYears": [],
        "teamSize": null,
        "requirements": []
      }
    },
    {
      "name": "湖北省2026年度大学生创业扶持项目",
      "cat": "创业",
      "direction": "创业实践",
      "org": "湖北省人力资源和社会保障厅等部门",
      "aud": "创意组：湖北高校/技工院校在校生；创业组另含毕业5年内毕业生并有在鄂注册经营等条件",
      "field": "湖北省",
      "a": 9.6,
      "note": "2026年申报窗口4月1日至5月15日，现已截止。创意组和创业组条件不同；未选组别时，不因就读省市或毕业身份直接判为不符。",
      "id": "fm-005",
      "dates": {
        "start": "2026-04-01",
        "end": "2026-05-15",
        "award": null,
        "deadlineAt": null,
        "timezone": "Asia/Shanghai",
        "published": "2026-03-31"
      },
      "source": {
        "url": "https://rst.hubei.gov.cn/zfxxgk/zc/qtzdgkwj/202603/t20260331_5902664.shtml",
        "kind": "official-notice",
        "verification": "verified",
        "verifiedAt": "2026-10-25",
        "lastAttemptAt": "2026-10-25",
        "lastAttemptResult": "http-200-body-reviewed",
        "importedClaimedCheckedAt": "2026-10-24",
        "importedClaimedStatus": "日期待核实",
        "registrationOpenOn": null,
        "evidence": {
          "bodySha256": "5fda3c1320b17352d96d631de3bf13a71fae2f8eca1d92955386581371b3d3bb",
          "quotes": [
            "4月1日至5月15日期间",
            "本项目设创意组、创业组"
          ],
          "scope": "核实公告所载日期与已列资格；不代表审核通过或实时接受报名。",
          "monitorHash": "e7db13bca4c4d5bf7d18a69d6053cbacd21bec17043be8f92c5cd7b8b2665caf"
        }
      },
      "eligibility": {
        "schools": [],
        "regions": [],
        "degrees": [],
        "enrollmentYears": [],
        "studyYears": [],
        "majorGroups": [],
        "enrolled": null,